id|date|time|timezone|user_id|username|tweet|replies|retweets|likes|location|hashtags|link
938558669297455104|2017-12-06|23:59:58|GTB Standard Time|3241975653|paul_tennison|Bitcoin tops $13,000 hours after passing $12,000. I'm working on drafting a bar journal article about cryptocurrency for my Law2050 class at Vanderbilt. #cryptocurrency #law #innovation #Vanderbiltlaw  https://blogs.wsj.com/moneybeat/2017/12/06/bitcoin-tops-12000-and-is-well-on-its-way-to-13000/ … via @WSJ|0|0|0||['#cryptocurrency', '#law', '#innovation', '#Vanderbiltlaw']|https://twitter.com/paul_tennison/status/938558669297455104/
938558666738876416|2017-12-06|23:59:58|GTB Standard Time|93532763|nufspordria|C Bounty ^^Something begin with letter 'C' is going to be launched on Dec 31. It's going to be amazing to see what is 'C' really is.#Bitcoin #Ether #Crypto #ICO #C #ICOs #cryptocurrency https://bitcointalk.org/index.php?topic=2494912.0 …|1|0|0||['#Bitcoin', '#Ether', '#Crypto', '#ICO', '#C', '#ICOs', '#cryptocurrency']|https://twitter.com/nufspordria/status/938558666738876416/
938558632001761280|2017-12-06|23:59:50|GTB Standard Time|2745484778|bavicrypto|great to see #HOQU at the blockchain conference #blockchain #cryptocurrency #ICO #altcoin @HOQU_IO hoqu.io https://twitter.com/HOQU_IO/status/938371455909335041 …|1|0|1||['#HOQU', '#blockchain', '#cryptocurrency', '#ICO', '#altcoin']|https://twitter.com/bavicrypto/status/938558632001761280/
938558627379544064|2017-12-06|23:59:49|GTB Standard Time|1860165115|JensO_86|Since @NiceHashMining is down, plan B is to use kryptex, get paied in btc. Join here:  http://bit.ly/2B8VgTT  I get about 10usd/daily on a 8x1070 rig. Not as good as @NiceHashMining was before the hack, but better than none #mining #crypto #cryptocurrencies #cryptocurrency|1|0|0||['#mining', '#crypto', '#cryptocurrencies', '#cryptocurrency']|https://twitter.com/JensO_86/status/938558627379544064/
938558613936775168|2017-12-06|23:59:45|GTB Standard Time|59189162|TouTzuSays|Thieves stole potentially millions of dollars in bitcoin in a hacking attack on a cryptocurrency company  http://www.businessinsider.com/nicehash-bitcoin-wallet-hacked-contents-stolen-in-security-breach-2017-12 … pic.twitter.com/cG1ovpu3Kj|0|0|2||[]|https://twitter.com/TouTzuSays/status/938558613936775168/
938558593632260099|2017-12-06|23:59:40|GTB Standard Time|924684593332187136|Zlancer_ZCG|Silence is golden. We won't give it all away, but here's a sneak peak. Join the revolution. $ZCG $ETH #zlancer #zcashgold #cryptocurrency #crypto #trade #silenceisgolden #zlanceriscoming #etherdelta #coinexchange #IDEX pic.twitter.com/vHdmUXpEzO|9|34|47||['#zlancer', '#zcashgold', '#cryptocurrency', '#crypto', '#trade', '#silenceisgolden', '#zlanceriscoming', '#etherdelta', '#coinexchange', '#IDEX']|https://twitter.com/Zlancer_ZCG/status/938558593632260099/
938558578750734336|2017-12-06|23:59:37|GTB Standard Time|2445623299|nipplescam|@picksnose ray do you want to start a new cryptocurrency with me|1|0|0||[]|https://twitter.com/nipplescam/status/938558578750734336/
938558502250917888|2017-12-06|23:59:19|GTB Standard Time|2388011826|bitcoinfirehose|CryptoCurrency epidemic: more countries consider alternatives against dollar domination tyranny  http://ift.tt/2AYuj4Q  #reddit #bitcoin|0|0|0||['#reddit', '#bitcoin']|https://twitter.com/bitcoinfirehose/status/938558502250917888/
938558450929487872|2017-12-06|23:59:06|GTB Standard Time|320304156|Investimenti_IT|Cryptocurrency is the next step in the digitization of everything — 'It's sort of inevitable'Lex Sokolin, Autonomous Research's director of fintech strategy, talks with Business Insider executive editor Sara Silverstein about the importance of cryptoc...  http://www.businessinsider.com/bitcoin-cryptocurrency-value-digitization-of-everything-lex-sokolin-2017-11 …|0|0|0||[]|https://twitter.com/Investimenti_IT/status/938558450929487872/
938558448538488833|2017-12-06|23:59:06|GTB Standard Time|50915317|JohnTheScaliwag|*makes 82 cents on a crypto-currency he paid 2.00 a coin for 2 coins..* “Yeah ive had my fun it’s Time to cash out*|0|0|0||[]|https://twitter.com/JohnTheScaliwag/status/938558448538488833/
938558432491253760|2017-12-06|23:59:02|GTB Standard Time|2148577236|iArtSometimes|Any idea which cryptocurrency I should be lookin at next???? @decapmusic I gotta pay these student loans lmao|0|0|1||[]|https://twitter.com/iArtSometimes/status/938558432491253760/
938558398764904453|2017-12-06|23:58:54|GTB Standard Time|928555969226969088|HearsayCrypto|##Cryptocurrency #News 5: Top 15 #Altcoins To HODL For 2018 Part 4 - #Altcoin #Crypto #Cryptonews -  http://cryptohearsay.com/2017/12/06/cryptocurrency-news-5-top-15-altcoins-to-hodl-for-2018-part-4-altcoin-crypto-cryptonews/ …Top 15 Altco...|0|0|0||['#Cryptocurrency', '#News', '#Altcoins', '#Altcoin', '#Crypto', '#Cryptonews']|https://twitter.com/HearsayCrypto/status/938558398764904453/
938558365109592064|2017-12-06|23:58:46|GTB Standard Time|3764994253|dred0982|@Mrlutavo $XRB is simply amazing !!!! <Emoji: Face with tears of joy> top<Emoji: Hundred points symbol> #93 now @CoinMarketCap $BTC #cryptocurrency #Altcoins $iota#XRBToTheMoon pic.twitter.com/gLx8KJewK4|0|0|1||['#93', '#cryptocurrency', '#Altcoins', '#XRBToTheMoon']|https://twitter.com/dred0982/status/938558365109592064/
938558357060890624|2017-12-06|23:58:44|GTB Standard Time|2871852080|general_p757|Bitcoin <Emoji: Eyes><Emoji: Eyes>$14000 geesh#Bitcoin #cryptocurrency|0|0|0||['#Bitcoin', '#cryptocurrency']|https://twitter.com/general_p757/status/938558357060890624/
938558335942578176|2017-12-06|23:58:39|GTB Standard Time|110556913|StephanieisLive|#latest digital game #sweeping internet collecting digital <Emoji: Cat face>&using crypto currency @CryptoKitties . <Emoji: Face with stuck-out tongue>  http://ow.ly/6kE230h3CyC  @genzexperts|0|0|1||['#latest', '#sweeping']|https://twitter.com/StephanieisLive/status/938558335942578176/
938558308188917760|2017-12-06|23:58:32|GTB Standard Time|873322491296526336|Darkparty2000|BITCOIN ABOVE $14,000!!!!! #BITCOIN#Cryptocurrency#currency365 pic.twitter.com/hULQXbWabL|0|0|0||['#BITCOIN', '#Cryptocurrency', '#currency365']|https://twitter.com/Darkparty2000/status/938558308188917760/
938558294356086784|2017-12-06|23:58:29|GTB Standard Time|2911455471|JaysonsRage|@DaveOshry @rickyftw And I thought I was staying on top of the crypto currency thing lol|1|0|0||[]|https://twitter.com/JaysonsRage/status/938558294356086784/
938558262168969216|2017-12-06|23:58:21|GTB Standard Time|1865621094|911NoPlaner| https://www.cnbc.com/2017/12/06/bitcoin-tops-13000-surging-1000-in-less-than-24-hours.html …#BREAKING #BreakingNews#Bitcoin blasts past $14,000!#btc $btc #cryptocurrency #cryptocurrencies #cryptocurrencynews #crypto #cryptonews – at New York Stock Exchange|0|0|0||['#BREAKING', '#BreakingNews', '#Bitcoin', '#btc', '#cryptocurrency', '#cryptocurrencies', '#cryptocurrencynews', '#crypto', '#cryptonews']|https://twitter.com/911NoPlaner/status/938558262168969216/
938558261065854976|2017-12-06|23:58:21|GTB Standard Time|89732547|lukethomas14|My history of picking cryptocurrency.  pic.twitter.com/oqVfLKM5N5|0|0|4||[]|https://twitter.com/lukethomas14/status/938558261065854976/
938558247887360000|2017-12-06|23:58:18|GTB Standard Time|835790516965027840|TheVisioProject|Visio Will Be Listed Soon On  http://Next.Exchange !!#cryptocurrency #visio #exchanges #blockchain #investment http://bit.ly/2AZspkq |1|9|14||['#cryptocurrency', '#visio', '#exchanges', '#blockchain', '#investment']|https://twitter.com/TheVisioProject/status/938558247887360000/
938558232838197248|2017-12-06|23:58:14|GTB Standard Time|48471517|kris_tarr|Thieves stole potentially millions of dollars in bitcoin in a hacking attack on a cryptocurrency company  http://ift.tt/2AypkHf  pic.twitter.com/Y7wREA53yE|0|0|0||[]|https://twitter.com/kris_tarr/status/938558232838197248/
938558211556118528|2017-12-06|23:58:09|GTB Standard Time|2422751880|usanews2017|Thieves stole potentially millions of dollars in bitcoin in a hacking attack on a cryptocurrency company  http://dlvr.it/Q4jnPF  #Economy pic.twitter.com/jPIkkArfcV|0|0|0||['#Economy']|https://twitter.com/usanews2017/status/938558211556118528/
938558208385224704|2017-12-06|23:58:09|GTB Standard Time|82757802|x3deeh|Regulation and the Future of Cryptocurrency at Token Summit II  http://dlvr.it/Q4jnNB  pic.twitter.com/daI5qmPumj|0|0|0||[]|https://twitter.com/x3deeh/status/938558208385224704/
938558201737265152|2017-12-06|23:58:07|GTB Standard Time|737327304|economy2018|Thieves stole potentially millions of dollars in bitcoin in a hacking attack on a cryptocurrency company  http://dlvr.it/Q4jnFH  #Economy pic.twitter.com/wXMO4FNKja|0|0|0||['#Economy']|https://twitter.com/economy2018/status/938558201737265152/
938558189116821504|2017-12-06|23:58:04|GTB Standard Time|2828290500|JordanSvedman|Dennis Gartman Still Won't Buy Bitcoin, Scared - Cointelegraph (Bitcoin, Cryptocurrency and Blockchain News)  http://ift.tt/2iyvmgW |0|0|0||[]|https://twitter.com/JordanSvedman/status/938558189116821504/
938558178370957312|2017-12-06|23:58:01|GTB Standard Time|730841085929525249|WeeklyJour|Thieves stole potentially millions of dollars in bitcoin in a hacking attack on a cryptocurrency company  http://www.businessinsider.com/nicehash-bitcoin-wallet-hacked-contents-stolen-in-security-breach-2017-12 …|0|0|0||[]|https://twitter.com/WeeklyJour/status/938558178370957312/
938558146720747521|2017-12-06|23:57:54|GTB Standard Time|841244385274613760|Moecashmediagro|BitcoinTV: by Cryptocurrency Market on YouTube … https://bitcoinmovementblogspotcom.wordpress.com/2017/12/06/bitcointv-by-cryptocurrency-market-on-youtube-28/ …|0|0|0||[]|https://twitter.com/Moecashmediagro/status/938558146720747521/
938558099580968961|2017-12-06|23:57:43|GTB Standard Time|924812006393344000|ALQOCOIN|We are officially listed on crypto-bridge now!  http://crypto-bridge.org  Trade $alqo now with low fees! #followtheorangerabbit #cryptocurrency #bitcoin #Ethereum $btc $eth $neo $ltc $dash|2|13|25||['#followtheorangerabbit', '#cryptocurrency', '#bitcoin', '#Ethereum']|https://twitter.com/ALQOCOIN/status/938558099580968961/
938558070753562624|2017-12-06|23:57:36|GTB Standard Time|1141822710|garnermarshall|$62 Million Gone? Cryptocurrency Mining Market NiceHash Hacked  https://plus.google.com/+GarnerMarshall/posts/dorDn4dHkk3 … pic.twitter.com/HGuky0tOOU|0|0|0||[]|https://twitter.com/garnermarshall/status/938558070753562624/
938558070682214400|2017-12-06|23:57:36|GTB Standard Time|30101619|gmarshNYC|$62 Million Gone? Cryptocurrency Mining Market NiceHash Hacked  https://plus.google.com/+GarnerMarshall/posts/dorDn4dHkk3 … pic.twitter.com/EcEastZHcE|0|0|0||[]|https://twitter.com/gmarshNYC/status/938558070682214400/
938558044929081344|2017-12-06|23:57:30|GTB Standard Time|2889656439|bmichaelyates|@getongab Essentially a crypto-mining botnet that pays for site upkeep. I like the concept, but worry about a specific crypto-currency gaining too much power over your platform. Possibly let users choose which CC they want to mine? Also, will there be on-site benefits for mining?|1|0|3||[]|https://twitter.com/bmichaelyates/status/938558044929081344/
938558014784552960|2017-12-06|23:57:22|GTB Standard Time|771179798735360001|fire_millennial|@indexshow Ron, I’m happy to see you’re talking about crypto currency! Where and how do you do your research? And, do you ever think it will be a valid portion of the investors portfolio, like equities and commodities?? Cheers!|3|0|1||[]|https://twitter.com/fire_millennial/status/938558014784552960/
938558013987725312|2017-12-06|23:57:22|GTB Standard Time|168379079|DavidAELevy|@NiceHashMining So are you saying OUR Nicehash Bitcoin Wallet balances have all been stolen?!  http://nicehash.com  Please be more specific. #cryptocurrency #hacked #nicehash #WTF #OHHELLNO #wheresmymoney #Bitcoin #moneystolen pic.twitter.com/AQHJchwqMB|0|1|1||['#cryptocurrency', '#hacked', '#nicehash', '#WTF', '#OHHELLNO', '#wheresmymoney', '#Bitcoin', '#moneystolen']|https://twitter.com/DavidAELevy/status/938558013987725312/
938558009629818880|2017-12-06|23:57:21|GTB Standard Time|316331833|GamerGeekNews|How much energy does Bitcoin consume, and can it improve?  http://feeds.boingboing.net/~r/boingboing/iBag/~3/3P5YQxW_F0E/digging-coal-with-asics.html … #imchangingtheclimateaskmehow #cryptocurrency #bitcoin|0|0|0||['#imchangingtheclimateaskmehow', '#cryptocurrency', '#bitcoin']|https://twitter.com/GamerGeekNews/status/938558009629818880/
938558008191266816|2017-12-06|23:57:21|GTB Standard Time|4354237403|CryptoBrokerIO|Dennis Gartman Still Won't Buy Bitcoin, Scared - Cointelegraph (Bitcoin, Cryptocurrency and Blockchain News) -  http://ift.tt/2iyvmgW  pic.twitter.com/a1cTemfiyA|0|0|0||[]|https://twitter.com/CryptoBrokerIO/status/938558008191266816/
938557989757378560|2017-12-06|23:57:16|GTB Standard Time|763175897197195264|WealthTrending|Join for #Free Today >  http://WealthTrending.com  and compound Your Earnings. Why #Bitcoin / #Bitcoins Surging Higher https://www.facebook.com/1090615584354830/photos/a.1107269936022728.1073741828.1090615584354830/1535101666572884/?type=3&notif_id=1511933248159519&notif_t=like … #cryptocurrency RT  @LoriMoreno #wealth #trending #wealthtrending pic.twitter.com/9xYX2nu0ga|0|0|0||['#Free', '#Bitcoin', '#Bitcoins', '#cryptocurrency', '#wealth', '#trending', '#wealthtrending']|https://twitter.com/WealthTrending/status/938557989757378560/
938557987328872449|2017-12-06|23:57:16|GTB Standard Time|1050470983|RHAF_HQ|Thieves stole potentially millions of dollars in bitcoin in a hacking attack on a cryptocurrency company  http://ift.tt/2krsMxB |0|0|0||[]|https://twitter.com/RHAF_HQ/status/938557987328872449/
938557974502608896|2017-12-06|23:57:13|GTB Standard Time|44627402|shiftclick|"New post: ""Thieves stole potentially millions of dollars in bitcoin in a hacking attack on a cryptocurrency company""  http://ift.tt/2AypkHf "|0|0|0||[]|https://twitter.com/shiftclick/status/938557974502608896/
938557968836001792|2017-12-06|23:57:11|GTB Standard Time|4143634523|shaishav81|A government or country that will ve pioneer in putting legal framework around ICO as securities. Will be at great advantage in coming race in #Blockchain based tech!!! It will go through boom n burst but whatever is left after that will form piller for next leg! #cryptocurrency|0|1|2||['#Blockchain', '#cryptocurrency']|https://twitter.com/shaishav81/status/938557968836001792/
938557861403049984|2017-12-06|23:56:46|GTB Standard Time|3320829946|sahilmillu|I can't wait to start cashing in my crypto currency gains. Gona cop a lambo first thing and put down a downpayment for a condo and move tf outa this shithole.|0|0|0||[]|https://twitter.com/sahilmillu/status/938557861403049984/
938557850238021633|2017-12-06|23:56:43|GTB Standard Time|760290961658306560|CryptoMob|There is a lot of bargain price deals on cryptocurrency right now, get in soon. $BTC $ETH $ZEN $POWR|0|0|0||[]|https://twitter.com/CryptoMob/status/938557850238021633/
938557847192739840|2017-12-06|23:56:42|GTB Standard Time|286820837|stevenmusil|Steam ends support for Bitcoin citing cryptocurrency's volatility, high fees  http://cnet.co/2AAaOyY  via @CNET|0|0|0||[]|https://twitter.com/stevenmusil/status/938557847192739840/
938557823725608960|2017-12-06|23:56:37|GTB Standard Time|262797667|JoeManzanares|“We didn’t think it was obvious to rush out a product and be first,” said CEO Jeff Sprecher, expressing concern about the lack of transparency at crypto exchanges, many of which will be referenced in price indexes used for cryptocurrency derivatives.  https://www.ethnews.com/nyse-exercises-patience-on-bitcoin-derivatives?platform=hootsuite …|0|0|1||[]|https://twitter.com/JoeManzanares/status/938557823725608960/
938557799604289536|2017-12-06|23:56:31|GTB Standard Time|767088635028135936|fathymohamd777|أضفت فيديو إلى قائمة تشغيل @YouTube على  http://youtu.be/7lIehqpwBFg?a  Get $15 of Cryptocurrency ( http://U.CASH ) In 5|0|0|0||[]|https://twitter.com/fathymohamd777/status/938557799604289536/
938557789349146624|2017-12-06|23:56:29|GTB Standard Time|729409729|ACKFlags|"""Cryptocurrency Price Surge Could Boost GPU Sales, Says Wall Street Analyst"""|1|1|1||[]|https://twitter.com/ACKFlags/status/938557789349146624/
938557747548659712|2017-12-06|23:56:19|GTB Standard Time|919145627639889922|vanraphy5|#BitcoinMoon #BCM #Cryptocurrency  https://docs.google.com/forms/d/e/1FAIpQLSdcUe5jtp_Q_3rCpIQZ-P9hjoQOQtydAgjmakDwiutiLp_Xeg/viewform … *|0|0|0||['#BitcoinMoon', '#BCM', '#Cryptocurrency']|https://twitter.com/vanraphy5/status/938557747548659712/
938557740267556864|2017-12-06|23:56:17|GTB Standard Time|3828430581|lifeoncoin|"""Thieves stole potentially millions of dollars in bitcoin in a hacking attack on a cryptocurrency company""  http://ift.tt/2AypkHf "|0|0|0||[]|https://twitter.com/lifeoncoin/status/938557740267556864/
938557715416272897|2017-12-06|23:56:11|GTB Standard Time|928555969226969088|HearsayCrypto|"#IOTA is off the Charts (CRYPTOCURRENCY) | Hong Kong -  http://cryptohearsay.com/2017/12/06/iota-is-off-the-charts-cryptocurrency-hong-kong/ …Big day for crypto, 500 subs on this channel, and explori..."|0|0|0||['#IOTA']|https://twitter.com/HearsayCrypto/status/938557715416272897/
938557708709564416|2017-12-06|23:56:09|GTB Standard Time|2275141800|alt_bit_coins|Forex broker FXPIG creates cryptocurrency exchange -  http://cryptogeeks.com/forex-broker-fxpig-creates-cryptocurrency-exchange …|0|0|0||[]|https://twitter.com/alt_bit_coins/status/938557708709564416/
938557680444198913|2017-12-06|23:56:03|GTB Standard Time|3352989029|CInvestINC|"""#BitCaptera ICO Whitepaper Review Is It A #Scam? $350 #Bitcoin Transfer #BitCap #Investment! Subscribe For #CryptoCurrency #ethereum #litecoin #Giveaway!"" #youtube FULL VIDEO CLICK LINK BELOW https://youtu.be/Wr5wxUeYv44 "|0|2|2||['#BitCaptera', '#Scam', '#Bitcoin', '#BitCap', '#Investment', '#CryptoCurrency', '#ethereum', '#litecoin', '#Giveaway', '#youtube']|https://twitter.com/CInvestINC/status/938557680444198913/
938557668943433729|2017-12-06|23:56:00|GTB Standard Time|905794759083614209|Crypto_News247|@adam_chal #XRBFeeless Instant Micro Transactions!!Decentralised And Proven!All coins distributed so no global warming issues either!This is the new Bitcoin.#RaiBlocks #XRB#BTC #CRYPTOCURRENCY|0|1|2||['#XRBFeeless', '#RaiBlocks', '#XRB', '#BTC', '#CRYPTOCURRENCY']|https://twitter.com/Crypto_News247/status/938557668943433729/
938557664220667905|2017-12-06|23:55:59|GTB Standard Time|1945076263|JanetOrendorff|Russian Finance Ministry suggests criminalizing cryptocurrency mining  https://www.rt.com/business/412132-bitcoin-cryptocurrencies-mining-russia/?utm_source=browser&utm_medium=aplication_chrome&utm_campaign=chrome#.WiiDiPscLww.twitter …|0|0|0||[]|https://twitter.com/JanetOrendorff/status/938557664220667905/
938557546893164544|2017-12-06|23:55:31|GTB Standard Time|28613387|phred84044|If you’re thinking about getting into cryptocurrency, sign up with Coinbase using my referral and get $10 Bitcoin bonus on deposits greater than $100.   https://www.coinbase.com/join/5a1e1c77822b360215f5d118 …|0|0|1||[]|https://twitter.com/phred84044/status/938557546893164544/
938557500328161281|2017-12-06|23:55:20|GTB Standard Time|2275141800|alt_bit_coins|In Washington, Venezuela’s plan to create a ‘#bitcoin’ seen as a sign of desperation #cryptocurrency #news $crypto  http://bit.ly/2AzrSos |0|0|0||['#bitcoin', '#cryptocurrency', '#news']|https://twitter.com/alt_bit_coins/status/938557500328161281/
938557493231407105|2017-12-06|23:55:18|GTB Standard Time|918393399316766722|realdoublebtcs|"RT bitcoinagile ""In Washington, Venezuela’s plan to create a ‘#bitcoin’ seen as a sign of desperation #cryptocurrency #news $crypto  http://bit.ly/2AzrSos """|0|0|0||['#bitcoin', '#cryptocurrency', '#news']|https://twitter.com/realdoublebtcs/status/938557493231407105/
938557481667715072|2017-12-06|23:55:15|GTB Standard Time|859586059|YourMicroMedia|Thieves stole potentially millions of dollars in bitcoin in a hacking attack on a cryptocurrency company - Business Insider  http://ift.tt/2B7akBt |0|0|0||[]|https://twitter.com/YourMicroMedia/status/938557481667715072/
938557433554841600|2017-12-06|23:55:04|GTB Standard Time|2917030200|uDigitalistas|Dennis Gartman Still Won't Buy Bitcoin, Scared - Cointelegraph (Bitcoin, Cryptocurrency and Blockchain News)  http://ift.tt/2iyvmgW |0|0|0||[]|https://twitter.com/uDigitalistas/status/938557433554841600/
938557432367927296|2017-12-06|23:55:04|GTB Standard Time|473130929|DJSAppcenter|Weekly: Bull Market Returns? Bitcoin Cash Summary  http://slninja.com/8m3v  #bitcoin #cryptocurrency  pic.twitter.com/cv6730a8Sr|0|0|0||['#bitcoin', '#cryptocurrency']|https://twitter.com/DJSAppcenter/status/938557432367927296/
938557431080194048|2017-12-06|23:55:03|GTB Standard Time|869333058876559361|CryptoPanicCom|<Emoji: Upwards arrow> +2 Bitcoin Hits $14,000 Record High and Slams Down Critiques  https://cryptopanic.com/news/531456/Bitcoin-Hits-14000-Record-High-and-Slams-Down-Critiques?utm_source=notifications&utm_medium=twitter&utm_campaign=Twitter+Trending … $BTC #bitcoin #XBT #cryptocurrency|0|1|2||['#bitcoin', '#XBT', '#cryptocurrency']|https://twitter.com/CryptoPanicCom/status/938557431080194048/
938557430887219200|2017-12-06|23:55:03|GTB Standard Time|386303422|ParkerJThomas|Thieves stole potentially millions of dollars in bitcoin in a hacking attack on a cryptocurrency company  http://read.bi/2ix29TI |0|0|0||[]|https://twitter.com/ParkerJThomas/status/938557430887219200/
938557429641547776|2017-12-06|23:55:03|GTB Standard Time|917858303950147585|iCashNetwork|$62 #Million Gone? #Cryptocurrency Mining Market #NiceHash Claims to be #Hacked http://ow.ly/NtIo30h3S6i |0|0|0||['#Million', '#Cryptocurrency', '#NiceHash', '#Hacked']|https://twitter.com/iCashNetwork/status/938557429641547776/
938557420183228421|2017-12-06|23:55:01|GTB Standard Time|104002334|HafExpressions|@yayaideris @faridbahrudin @Zakikml Crypto currency?|0|0|0||[]|https://twitter.com/HafExpressions/status/938557420183228421/
938557403703988224|2017-12-06|23:54:57|GTB Standard Time|804729710|SushilKeswani1|What will happen once all the 21 million #Bitcoin are in circulation? Will more Bitcoins get mined? If not what will determine the value or price of the Bitcoin #cryptocurrency|0|0|0||['#Bitcoin', '#cryptocurrency']|https://twitter.com/SushilKeswani1/status/938557403703988224/
938557357210075137|2017-12-06|23:54:46|GTB Standard Time|155402885|iCach0|@HDRetrovision @db_electronics My shoeshine boy gave me some great cryptocurrency investing tips today.<Emoji: Upside-down face>|0|0|1||[]|https://twitter.com/iCach0/status/938557357210075137/
938557347823325189|2017-12-06|23:54:43|GTB Standard Time|899975794302341120|altcoinmaniac|#iota vs #bitcoin graph for 15 min. You can see how iota price fluctation connected with bitcoin price fluctation#altcoins #cryptocurrency #MIOTA pic.twitter.com/r7amFkMIcP|0|1|3||['#iota', '#bitcoin', '#altcoins', '#cryptocurrency', '#MIOTA']|https://twitter.com/altcoinmaniac/status/938557347823325189/
938557341590605824|2017-12-06|23:54:42|GTB Standard Time|809595854805929985|meddelem|@StefanMolyneux Crypto-currency is destabilizing all world currencies, and when the world's financial institutions collapse, Crypto-currency will disappear like a fart in the wind.|0|0|2||[]|https://twitter.com/meddelem/status/938557341590605824/
938557292873691137|2017-12-06|23:54:30|GTB Standard Time|908623125067239424|CryptoWhaleCall|EMC2 also went insane... remember buying it at ~700 satoshi's like a month ago...?$BTC $ETH $crypto $alts $MTL $EMC2 $PAY $LTC $NEO $STRAT $TKN $OMG #BTC #ETH #cryptocurrency $QTUM $iota $game $BAY $ARDR $BAT $BCC $sc $BTG|0|1|2||['#BTC', '#ETH', '#cryptocurrency']|https://twitter.com/CryptoWhaleCall/status/938557292873691137/
938557292110368768|2017-12-06|23:54:30|GTB Standard Time|189477465|Sergi_Trance|From tomorrow we´ll be able to buy cryptocurrency using the Revolut app for only 1,5% fee. Big investment from the app. Will this impact the Bitcoin rate? For sure.  https://lnkd.in/eRwQm3N |0|0|1||[]|https://twitter.com/Sergi_Trance/status/938557292110368768/
938557257515544576|2017-12-06|23:54:22|GTB Standard Time|93532763|nufspordria|Ever heard of C?does C stand for? sCam? Capital? Crypto? wait on 31st Jan 2018#Bitcoin #Ether #Crypto #ICO #C #ICOs #Cryptocurrency http://bitcointalk.org/index.php?topi …|0|0|0||['#Bitcoin', '#Ether', '#Crypto', '#ICO', '#C', '#ICOs', '#Cryptocurrency']|https://twitter.com/nufspordria/status/938557257515544576/
938557222895935488|2017-12-06|23:54:14|GTB Standard Time|744474864|michaelrosa1979|Thieves stole potentially millions of dollars in bitcoin in a hacking attack on a cryptocurrency company #Business http://ift.tt/2AypkHf |0|0|0||['#Business']|https://twitter.com/michaelrosa1979/status/938557222895935488/
938557205279924225|2017-12-06|23:54:09|GTB Standard Time|1865621094|911NoPlaner|#Bitcoin surges $900 past $12,000 to record high  http://cnb.cx/2B29B4k  $btc #cryptonews #cryptocurrencies #crypto #cryptocurrency|0|1|0||['#Bitcoin', '#cryptonews', '#cryptocurrencies', '#crypto', '#cryptocurrency']|https://twitter.com/911NoPlaner/status/938557205279924225/
938557202431922177|2017-12-06|23:54:09|GTB Standard Time|928813572704043009|crypto_newbie0|Musicoin - Get 50 Coins just by signing up - FILL and GET cryptocurrency: https://docs.google.com/forms/d/e/1FAIpQLScBZauRKu68kurJYOEG22NmwfTanK6SDGuVoqaJXJq4mRKoSw/viewform?usp=sf_link …|0|0|0||[]|https://twitter.com/crypto_newbie0/status/938557202431922177/
